{
  "id": "demo-placement",
  "schemaVersion": "1.0.0",
  "revision": 1,
  "status": "draft",
  "pairId": "fa-de",
  "mode": "fixed",
  "scoringModelVersion": "1.0.0",
  "assessedLevels": ["A1"],
  "items": [
    {
      "exerciseId": "demo-exercise-1",
      "revision": 1,
      "targetLevel": "A1",
      "weight": 1
    }
  ]
}
